{
  "version": "1.0.0",
  "author": "MeShell",
  "github": "ilya-bondarev",
  "license": "MIT-0",
  "min_app_version": "0.10.0",
  "category": "files",
  "icon": "folder",
  "requirements": [
    "MeShell ADB-shell broker"
  ],
  "translations": {
    "ru": {
      "title": "Место на диске",
      "description": "Самые большие папки и файлы, медиа и свежие загрузки"
    }
  }
}
