{
  "version": "1.0.0",
  "author": "MeShell",
  "github": "ilya-bondarev",
  "license": "MIT-0",
  "min_app_version": "0.10.0",
  "category": "system",
  "icon": "screen",
  "requirements": [
    "MeShell ADB-shell broker"
  ],
  "translations": {
    "ru": {
      "title": "Тёмная тема",
      "description": "Тёмная, светлая или автоматическая тема системы одним нажатием"
    }
  }
}
